{
  "$schema": "https://json-schema.org/draft/2020-12/schema",
  "$id": "contracts/control-center/v1/events/ai-egress-approval.recorded.schema.json",
  "title": "ai-egress-approval.recorded",
  "description": "Emitted when ai-egress-approval.response.schema.json's decision (approved/denied) is recorded (issue #217). Carries only the closed decision outcome and reason - never the approval request's justification text or any prompt/transcript/credential content. Delivered over the existing pull-worker/outbox transport (ADR-0027, issue #192).",
  "type": "object",
  "required": [
    "event_id",
    "event_version",
    "event_type",
    "occurred_at",
    "tenant_id",
    "correlation_id",
    "idempotency_key",
    "actor",
    "source",
    "data"
  ],
  "additionalProperties": false,
  "properties": {
    "event_id": {
      "type": "string",
      "pattern": "^[A-Za-z0-9_.:-]{1,128}$"
    },
    "event_version": {
      "type": "string",
      "pattern": "^v[0-9]+$"
    },
    "event_type": {
      "type": "string",
      "const": "ai-egress-approval.recorded"
    },
    "occurred_at": {
      "type": "string",
      "pattern": "^\\d{4}-\\d{2}-\\d{2}T\\d{2}:\\d{2}:\\d{2}Z$"
    },
    "tenant_id": {
      "type": "string",
      "pattern": "^[A-Za-z0-9_.:-]{1,128}$"
    },
    "correlation_id": {
      "type": "string",
      "pattern": "^[A-Za-z0-9_.:-]{1,128}$"
    },
    "idempotency_key": {
      "type": "string",
      "pattern": "^[A-Za-z0-9_.:-]{8,256}$"
    },
    "actor": {
      "type": "object",
      "required": ["type", "id"],
      "additionalProperties": false,
      "properties": {
        "type": {
          "type": "string",
          "enum": ["user", "service"]
        },
        "id": {
          "type": "string",
          "pattern": "^[A-Za-z0-9_.:-]{1,128}$"
        }
      }
    },
    "source": {
      "type": "string",
      "enum": ["omes", "hermes", "control-center"]
    },
    "data": {
      "type": "object",
      "required": ["approval_id", "target", "decision", "reason_code"],
      "additionalProperties": false,
      "properties": {
        "approval_id": {
          "type": "string",
          "pattern": "^[A-Za-z0-9_.:-]{1,128}$"
        },
        "target": {
          "type": "object",
          "required": ["server_id"],
          "additionalProperties": false,
          "properties": {
            "server_id": {
              "type": "string",
              "pattern": "^[A-Za-z0-9_.:-]{1,128}$"
            },
            "deployment_id": {
              "type": "string",
              "pattern": "^[A-Za-z0-9_.:-]{1,128}$"
            }
          }
        },
        "decision": {
          "type": "string",
          "enum": ["approved", "denied"]
        },
        "reason_code": {
          "type": "string",
          "enum": [
            "AI_EGRESS_APPROVAL_REQUIRED_CONFIDENTIAL_PRIVATE_ENDPOINT",
            "AI_EGRESS_APPROVAL_REQUIRED_CONFIDENTIAL_CLOUD_SANITIZED",
            "AI_EGRESS_APPROVAL_REQUIRED_RESTRICTED_PRIVATE_ENDPOINT",
            "AI_EGRESS_APPROVAL_DENIED_CROSS_TENANT",
            "AI_EGRESS_APPROVAL_DENIED_NOT_APPROVABLE",
            "AI_EGRESS_APPROVAL_DENIED_RESTRICTED_CLOUD_NEVER_APPROVABLE",
            "AI_EGRESS_APPROVAL_DENIED_BY_ACTOR"
          ]
        }
      }
    }
  }
}
