{
  "event_id": "evt-approval-0002",
  "event_version": "v1",
  "event_type": "ai-egress-approval.recorded",
  "occurred_at": "2026-09-24T12:00:10Z",
  "tenant_id": "tenant-acme",
  "correlation_id": "corr-approval-0007",
  "idempotency_key": "approval-evt-00000002",
  "actor": {
    "type": "service",
    "id": "service-awcms-approval-gate"
  },
  "source": "control-center",
  "data": {
    "approval_id": "approval-0000000007",
    "target": {
      "server_id": "server-acme-01"
    },
    "decision": "denied",
    "reason_code": "AI_EGRESS_APPROVAL_DENIED_CROSS_TENANT"
  }
}
