{
  "event_id": "evt-approval-0001",
  "event_version": "v1",
  "event_type": "ai-egress-approval.recorded",
  "occurred_at": "2026-09-24T12:00:05Z",
  "tenant_id": "tenant-acme",
  "correlation_id": "corr-approval-0001",
  "idempotency_key": "approval-evt-00000001",
  "actor": {
    "type": "user",
    "id": "user-owner-01"
  },
  "source": "control-center",
  "data": {
    "approval_id": "approval-0000000001",
    "target": {
      "server_id": "server-acme-01"
    },
    "decision": "approved",
    "reason_code": "AI_EGRESS_APPROVAL_REQUIRED_CONFIDENTIAL_PRIVATE_ENDPOINT"
  }
}
